{"max_upload_size": [314572800], "success": true, "feature_flags_dict": {"force_bulk_api_throttling_limit": null, "zero_score_value": 0, "anaplan_basic_data_integration": null, "hide_prioritization_pipeline_boxes": null, "demand_center_feature_flag": null, "enable_rank_f": null}, "token": "eyJhbGciOiJIUzI1NiIsInR5cCI6IkpXVCJ9.eyJ1c2VybmFtZSI6IjM0NjRfbWludGlnbzIwQGdtYWlsLmNvbSIsIm9yaWdfaWF0IjoxNjU0NTIzODAzLCJleHAiOjE2NTQ1MjU2MDMsInVzZXJfaWQiOjc0NzQsImN1c3RvbWVyX2lkIjozNDY0LCJlbWFpbCI6Im1pbnRpZ28yMEBnbWFpbC5jb20ifQ.wylrWIInBiNhrejYT3gkhIb1FlXWGMnk01mLJP0YKNs", "uploadSizeLimit": [52428800], "password_expiration": {"gentle_change_password": false, "password_age": 196, "enforce_change_password": false, "password_days_left": -196}, "customer_configuration": {"hasNNLeads": false, "has_active_zoominfo_integration": false, "is_sso_login": false, "hasNNAccounts": false, "contract_type": 1, "enable_demand_center": 0, "is_sso_active": false}, "redirect_url": "create-market", "user": {"first_name": "Anaplan", "last_name": "Test", "user_id": 7474, "features": "enable_rank_f,demand_center_feature_flag,anaplan_basic_data_integration,force_bulk_api_throttling_limit,zero_score_value", "markets_count": {"leads_type": 0, "total": 0, "accounts_type": 0, "behavioral_type": 0}, "salesCoach360Version": "3.2.0", "customer_type": "Internal", "created_on": "2021-11-22 09:55:46.832324", "is_admin": false, "notific_data": {"id": "1f4a57e429b074bc94a0a9ac1670614fba3b40189270557bbbee210c7a8e4eb1", "hmac": "f11426621ffaf5100ca19f6cde1f4c258eebe00999f04fc9b2903a0562836ece", "role": "View Only", "customerId": "ce86287c4c28240fe06afcb0f4c2aac85a5a1a4a4e203c32cf31108cc36c1f8a", "dateCreated": "22-11-2021"}, "permissions": ["viewDemandCenterSegments", "viewMarkets"], "customer_id": 3464, "user_email": "mintigo20@gmail.com", "customer_name": "Test24"}}